id|faction_id|name|legend|description|detachment|detachment_id|
000009082|GC|Integrated Tactics|Coordinating with their militant allies via stolen vox equipment or signalling with cult icons, the insidious broodkin engulfs the hated foe in overlapping fields of fire.|Each time an <span class="tooltip00809" data-tooltip-content="#tooltip_content00809" data-tooltip-anchor="#tooltip_content00809"><span class="kwb kwbu">ASTRA</span> <span class="kwb kwbu">MILITARUM</span></span> unit from your army (see below) is selected to shoot, you can select one enemy unit within 18" of and <a href="/wh40k10ed/the-rules/core-rules/#Determining-Visibility">visible</a> to that unit. If you do, until the end of the phase, models in that <span class="kwb">ASTRA</span> <span class="kwb">MILITARUM</span> unit can only target that enemy unit (and only if it is an eligible target) and that enemy unit is caught in overlapping fire. While an enemy unit is caught in overlapping fire, each time a <span class="kwb">GENESTEALER</span> <span class="kwb">CULTS</span> model from your army targets that enemy unit with a ranged attack, add 1 to the <span class="tooltip00003" data-tooltip-content="#tooltip_content00003"><span class="tt kwbu">Hit</span> <span class="tt kwbu">roll</span></span>. |Brood Brother Auxilia|000000888|
000009083|GC|BROOD BROTHERS||You can include <span class="tooltip00809" data-tooltip-content="#tooltip_content00809" data-tooltip-anchor="#tooltip_content00809"><span class="kwb kwbu">ASTRA</span> <span class="kwb kwbu">MILITARUM</span></span> units in your army, even though they do not have the <span class="kwb">GENESTEALER</span> <span class="kwb">CULTS</span> <a href="/wh40k10ed/the-rules/core-rules/#Keywords">Faction keyword</a>. The combined points cost of such units you can include in your army is:<br><ul><li>Incursion: Up to 500 pts</li><li>Strike Force: Up to 1000 pts</li><li>Onslaught: Up to 1500 pts</li></ul>A <span class="kwb">GENESTEALER</span> <span class="kwb">CULTS</span> model must be your <span class="kwb">WARLORD</span>, and <span class="kwb">ASTRA</span> <span class="kwb">MILITARUM</span> models from your army lose the <span class="tooltip00488" data-tooltip-content="#tooltip_content00488"><span class="tt kwbu">Voice</span> <span class="tt kwbu">of</span> <span class="tt kwbu">Command</span></span> ability if they have it. You cannot include units with any of the following <a href="/wh40k10ed/the-rules/rules-commentary/#Keywords">keywords</a> in your army using this rule: <span class="kwb">AIRCRAFT</span>; <span class="kwb">COMMISSAR</span>; <span class="kwb">EPIC</span> <span class="kwb">HERO</span>; <span class="kwb">MILITARUM</span> <span class="kwb">TEMPESTUS</span>; <span class="kwb">OGRYN</span>; <span class="kwb">RATLING</span>; <span class="kwb">TECH-PRIEST</span> <span class="kwb">ENGINSEER</span>; <span class="kwb">MINISTORUM</span> <span class="kwb">PRIEST</span>.|Brood Brother Auxilia|000000888|
000009459|GC|Harassing Fire|Focusing on hit-and-fade tactics to wear their enemies down, the guerrilla fighters of the cult hammer the foe with swift volleys before vanishing back behind closing hatches.|At the encl of your <a href="/wh40k10ed/the-rules/core-rules/#SHOOTING-PHASE">Shooting phase</a>, you can select one <span class="kwb">GENESTEALER</span> <span class="kwb">CULTS</span> unit from your army that is not within <a href="/wh40k10ed/the-rules/boarding-action-rules/#Engagement-Range">Engagement Range</a> of one or more enemy units. If you do, that unit can attempt to operate one <a href="/wh40k10ed/the-rules/boarding-action-rules/#Open-Hatchways">open Hatchway</a> it is within 1" of (if there is one), and can then make a <span class="tooltip00280" data-tooltip-content="#tooltip_content00280"><span class="tt kwbu">Normal</span> <span class="tt kwbu">move</span></span> of up to 3" (regardless of whether it attempted to <a href="/wh40k10ed/the-rules/boarding-action-rules/#Open-Hatchways">operate a Hatchway</a> or not). Until the end of the turn, that unit is not eligible to <a href="/wh40k10ed/the-rules/core-rules/#CHARGE-PHASE">declare a charge</a>.|Cult Unveiled|000000939|
000009467|GC|Blessed Visages|To the faithful of the cult, these warriors appear as the blessed and beatific chosen of the Star Children. To all others they are grotesque hybrid horrors whose unnatural aspect triggers repulsion and aversion in equal measure.|Each time an enemy unit <span class="tooltip00080" data-tooltip-content="#tooltip_content00080"><span class="tt kwbu">declares</span> <span class="tt kwbu">a</span> <span class="tt kwbu">charge</span></span> that targets one or more <span class="kwb">GENESTEALER</span> <span class="kwb">CULTS</span> units from your army, that enemy unit must take a <span class="tooltip00587" data-tooltip-content="#tooltip_content00587"><span class="tt kwbu">Leadership</span> <span class="tt kwbu">test</span></span>. If failed, until the end of the turn, each time a model in that enemy unit makes an attack, subtract 1 from the <span class="tooltip00003" data-tooltip-content="#tooltip_content00003"><span class="tt kwbu">Hit</span> <span class="tt kwbu">roll</span></span>.|Genespawn Onslaught|000000940|
000009475|GC|Half-Glimpsed Shadows|Possessed of alien cunning and unnatural stealth, Genestealers are able to fade back into the shadows or crawl across ceilings or under deck-plates, the better to evade notice by their prey.|Each time a ranged attack targets a <span class="tooltip00810" data-tooltip-content="#tooltip_content00810" data-tooltip-anchor="#tooltip_content00810"><span class="kwb kwbu">GREAT</span> <span class="kwb kwbu">DEVOURER</span></span> unit from your army, if the attacking model is not within 6" of that unit, subtract 1 from the <span class="tooltip00003" data-tooltip-content="#tooltip_content00003"><span class="tt kwbu">Hit</span> <span class="tt kwbu">roll</span></span>.|Infestation Swarm|000000941|
000009826|GC|Psionic Parasitism|With each tug on the synaptic leash, the Hive Mind drains more of its hapless worshippers.|At the end of your <a href="/wh40k10ed/the-rules/core-rules/#MOVEMENT-PHASE">Movement phase</a>, for each <span class="tooltip00663" data-tooltip-content="#tooltip_content00663" data-tooltip-anchor="#tooltip_content00663"><span class="kwb kwbu">TYRANIDS</span> <span class="kwb kwbu">SYNAPSE</span></span> unit from your army, you can select one friendly <span class="tooltip00664" data-tooltip-content="#tooltip_content00664" data-tooltip-anchor="#tooltip_content00664"><span class="kwb kwbu">GENESTEALER</span> <span class="kwb kwbu">CULTS</span></span> unit (excluding <a class="kwbOne" href="/wh40k10ed/factions/genestealer-cults/Purestrain-Genestealers"><span class="kwb kwbo">PURESTRAIN</span> <span class="kwb kwbo">GENESTEALER</span></a> and <a class="kwbOne" href="/wh40k10ed/factions/genestealer-cults/Patriarch"><span class="kwb kwbo">PATRIARCH</span></a> units) and one friendly <span class="tooltip00662" data-tooltip-content="#tooltip_content00662" data-tooltip-anchor="#tooltip_content00662"><span class="kwb kwbu">TYRANIDS</span></span> unit each within 9" of and <a href="/wh40k10ed/the-rules/core-rules/#Determining-Visibility">visible</a> to that <span class="kwb">SYNAPSE</span> unit. If you do, that <span class="kwb">GENESTEALER</span> <span class="kwb">CULTS</span> unit from your army suffers D3+1 <span class="tooltip00108" data-tooltip-content="#tooltip_content00108"><span class="tt kwbu">mortal</span> <span class="tt kwbu">wounds</span></span> and one model in the selected <span class="kwb">TYRANIDS</span> unit regains up to that many lost wounds and until the start of your next Movement phase, each time a model in the selected <span class="kwb">TYRANIDS</span> unit makes an attack, add 1 to the <span class="tooltip00003" data-tooltip-content="#tooltip_content00003"><span class="tt kwbu">Hit</span> <span class="tt kwbu">roll</span></span>.<br><br><span class="kwb">TYRANIDS</span> units from your army have the following ability:<br><br><b>Catalyst (Aura):</b> While an enemy unit is within 6" of this unit, each time a friendly <span class="kwb">GENESTEALER</span> <span class="kwb">CULTS</span> unit makes an attack that targets that enemy unit, add 1 to the <span class="tooltip00003" data-tooltip-content="#tooltip_content00003"><span class="tt kwbu">Hit</span> <span class="tt kwbu">roll</span></span>.<br><br><span class="hi_custom">The Star Children’s Blessings</span><br>You can include <span class="tooltip00665" data-tooltip-content="#tooltip_content00665" data-tooltip-anchor="#tooltip_content00665"><span class="kwb kwbu">TYRANIDS</span> <span class="kwb kwbu">VANGUARD</span> <span class="kwb kwbu">INVADER</span></span> units (excluding <span class="kwb">AIRCRAFT</span>, <span class="kwb">BROODLORD</span> and <span class="kwb">GENESTEALERS</span> units) in your army. The combined points cost of such units depends on your battle size:<br><ul><li><b>Incursion:</b> Up to 500 pts</li><li><b>Strike Force:</b> Up to 1000 pts</li><li><b>Onslaught:</b> Up to 1500 pts</li></ul><br>No <span class="kwb">TYRANIDS</span> models from your army can be your <span class="kwb">WARLORD</span>.|Final Day|000001002|
000009484|GK|An Urgent Duty|None can be allowed to reach an escape craft or get a distress call away - the purge must be swift and total. This knowledge lends the Grey Knights even greater urgency.|Add 1 to <span class="tooltip00295" data-tooltip-content="#tooltip_content00295"><span class="tt kwbu">Advance</span></span> and <span class="tooltip00080" data-tooltip-content="#tooltip_content00080"><span class="tt kwbu">Charge</span> <span class="tt kwbu">rolls</span></span> made for <span class="kwb">GREY</span> <span class="kwb">KNIGHTS</span> units from your army.|Void Purge Force|000000943|
000009492|GK|Pre-Emptive Strike|Employing ancient teleportation technologies, the Grey Knights are able to strike deep into enemy vessels or reposition with supernatural haste to defend vital sites on their own ships.|In the <a href="/wh40k10ed/the-rules/core-rules/#2.-Reinforcements">Reinforcements step</a> of your first <a href="/wh40k10ed/the-rules/boarding-action-rules/#Movement-Phase">Movement phase</a>, you can <a href="/wh40k10ed/the-rules/boarding-action-rules/#Set-Up">set up</a> on the battlefield one <span class="kwb">GREY</span> <span class="kwb">KNIGHTS</span> <a href="/wh40k10ed/the-rules/core-rules/#2.-Reinforcements">Reserves</a> unit from your army using the <a href="/wh40k10ed/the-rules/boarding-action-rules/#Before-the-Battle">Deep Strike ability</a>. When doing so, you can set up that unit anywhere on the battlefield that is more than 6" horizontally away from all enemy models (measure this distance as you would normally for the Deep Strike ability). Until the end of the turn, that unit is not eligible to <a href="/wh40k10ed/the-rules/core-rules/#CHARGE-PHASE">declare a charge</a>.|Baneslayer Strike|000000944|
000009776|GK|Hallowed Ground|Purging corrupted nodes of Warp energy, the Grey Knights establish an ever-expanding area of hallowed ground within which their psychic powers and indomitable resolve are greatly enhanced.|Certain areas of the battlefield are within your army’s Hallowed Ground, as follows:<br><ul><li>Your deployment zone is always within your army’s Hallowed Ground.</li><li>The area of the battlefield within 6" of one or more <a class="kwbOne" href="/wh40k10ed/factions/grey-knights/Purifier-Squad"><span class="kwb kwbo">PURIFIER</span> <span class="kwb kwbo">SQUAD</span></a> units from your army is within your army’s Hallowed Ground.</li><li>At the start of any phase, if you control at least half of the <span class="tooltip00045" data-tooltip-content="#tooltip_content00045"><span class="tt kwbu">objective</span> <span class="tt kwbu">markers</span></span> within No Man’s Land, until the end of that phase, No Man’s Land is within your army’s Hallowed Ground.</li><li>At the start of any phase, if you control at least half of the objective markers within your opponent’s deployment zone, until the end of that phase, your opponent’s deployment zone is within your army’s Hallowed Ground.</li></ul>Each time a model in a <span class="kwb">GREY</span> <span class="kwb">KNIGHTS</span> unit from your army makes a ranged attack that targets a <a href="/wh40k10ed/the-rules/core-rules/#Determining-Visibility">visible</a> target or makes a melee attack, re-roll a <span class="tooltip00003" data-tooltip-content="#tooltip_content00003"><span class="tt kwbu">Hit</span> <span class="tt kwbu">roll</span></span> of 1. If that unit is a <span class="kwb">PURIFIER</span> <span class="kwb">SQUAD</span> and/or is wholly within your army’s Hallowed Ground, you can re-roll the Hit roll instead.|Warpbane Task Force|000000992|
000010347|GK|Fury of Titan|Erupting from whirling Warp gates with their Nemesis blades blazing, squads of Grey Knights cut a bloody path through their enemies before the foe even realise their peril.|Each time a unit from your army is set up using the <span class="tooltip00065" data-tooltip-content="#tooltip_content00065"><span class="tt kwbu">Deep</span> <span class="tt kwbu">Strike</span></span> ability, until the end of the turn, each time a model in that unit makes an attack, re-roll a <span class="tooltip00003" data-tooltip-content="#tooltip_content00003"><span class="tt kwbu">Hit</span> <span class="tt kwbu">roll</span></span> of 1 and re-roll a <span class="tooltip00050" data-tooltip-content="#tooltip_content00050"><span class="tt kwbu">Wound</span> <span class="tt kwbu">roll</span></span> of 1.|Brotherhood Strike|000001081|
000010351|GK|Duty Before All|Every Grey Knights Terminator is a tower of strength, a massively armoured living war engine clad in warded truesilver. Seeking to bar the path of such warriors, to entrap them or deny their will, is as futile a course of action as trying to halt an avalanche with bare hands alone.|<span class="tooltip00811" data-tooltip-content="#tooltip_content00811" data-tooltip-anchor="#tooltip_content00811"><span class="kwb kwbu">GREY</span> <span class="kwb kwbu">KNIGHTS</span> <span class="kwb kwbu">TERMINATOR</span></span> units from your army are eligible to shoot and declare a charge in a turn in which they <span class="tooltip00054" data-tooltip-content="#tooltip_content00054"><span class="tt kwbu">Fell</span> <span class="tt kwbu">Back</span></span>.|Hallowed Conclave|000001082|
000010355|GK|Channelled Force|So potent is the interwoven mind-choir of this strike force that each individual can syphon off a portion of its gestalt might to empower their weapons of war without diminishing the whole. The result is Nemesis force weapons that blaze like caged psychic stars, leaving trails of witchfire blazing behind every swing and blasting victims into nothing with a single strike.|Each time a <span class="tooltip00459" data-tooltip-content="#tooltip_content00459" data-tooltip-anchor="#tooltip_content00459"><span class="kwb kwbu">GREY</span> <span class="kwb kwbu">KNIGHTS</span></span> unit from your army is selected to fight, that unit can take a <span class="tooltip00587" data-tooltip-content="#tooltip_content00587"><span class="tt kwbu">Leadership</span> <span class="tt kwbu">test</span></span>. If that test is passed, select one of the following rules. Until the end of the phase, that unit has that rule.<br><ul><li>Melee weapons equipped by models in this unit with the <span class="kwb2 bluefont"><span class="tooltip00607" data-tooltip-content="#tooltip_content00607"><span class="tt kwbu">[psychic]</span></span></span> ability also have the <span class="kwb2 bluefont"><span class="tooltip00001" data-tooltip-content="#tooltip_content00001"><span class="tt kwbu">[sustained</span> <span class="tt kwbu">hits</span> <span class="tt kwbu">1]</span></span></span> ability.</li><li>Melee weapons equipped by models in this unit with the <span class="kwb2 bluefont"><span class="tooltip00607" data-tooltip-content="#tooltip_content00607"><span class="tt kwbu">[psychic]</span></span></span> ability also have the <span class="kwb2 bluefont"><span class="tooltip00277" data-tooltip-content="#tooltip_content00277"><span class="tt kwbu">[LETHAL</span> <span class="tt kwbu">HITS]</span></span></span> ability.</li></ul>|Banishers|000001083|
000010359|GK|Mailed Fist|Such concentrations of the Grey Knights’ armoured power are only unleashed when time is of the essence, and the price of defeat would be utterly disastrous. Knowing all this, these hosts strike with tremendous force and unstoppable momentum, a mailed fist driven straight down the enemy’s throat.|Each time a <span class="tooltip00460" data-tooltip-content="#tooltip_content00460" data-tooltip-anchor="#tooltip_content00460"><span class="kwb kwbu">GREY</span> <span class="kwb kwbu">KNIGHTS</span> <span class="kwb kwbu">VEHICLE</span></span> unit from your army Advances, do not make an <span class="tooltip00295" data-tooltip-content="#tooltip_content00295"><span class="tt kwbu">Advance</span> <span class="tt kwbu">roll</span></span> for it; until the end of the phase, add 6" to the Move characteristic of models in that unit, and until the end of the turn, ranged weapons equipped by models in that unit have the <span class="kwb2 bluefont"><span class="tooltip00276" data-tooltip-content="#tooltip_content00276"><span class="tt kwbu">[ASSAULT]</span></span></span> ability.|Sanctic Spearhead|000001084|
000010363|GK|Prescient Redeployment|Combining the psychic disciplines of precognition and translocation, the Grey Knights rapidly relocate in response to strategic manoeuvres the foe has yet to make.|From the second <a href="/wh40k10ed/the-rules/core-rules/#The-Battle-Round">battle round</a> onwards, at the start of your <a href="/wh40k10ed/the-rules/core-rules/#MOVEMENT-PHASE">Movement phase</a>, if you did not select the maximum number of <span class="tooltip00459" data-tooltip-content="#tooltip_content00459" data-tooltip-anchor="#tooltip_content00459"><span class="kwb kwbu">GREY</span> <span class="kwb kwbu">KNIGHTS</span></span> units from your army using the <span class="tooltip00676" data-tooltip-content="#tooltip_content00676"><span class="tt kwbu">Gate</span> <span class="tt kwbu">of</span> <span class="tt kwbu">Infinity</span></span> ability at the end of your opponent’s previous turn, you can select one <span class="kwb">GREY</span> <span class="kwb">KNIGHTS</span> unit from your army that is on the battlefield that could have been selected using the Gate of Infinity ability. Remove that unit from the battlefield and place it into <a href="/wh40k10ed/the-rules/core-rules/#Strategic-Reserves">Strategic Reserves</a>.<br><br><b>Designer’s Note:</b> <i>This means that your unit can retain its position on the battlefield at the end of your <a href="/wh40k10ed/the-rules/core-rules/#COMMAND-PHASE">Command phase</a>, and then be placed into Strategic Reserves at the start of your Movement phase, to set it up again in your <a href="/wh40k10ed/the-rules/core-rules/#2.-Reinforcements">Reinforcements step</a> in another position.</i>|Augurium Task Force|000001085|
000009528|LoV|Stalwart Advance|The Kin proceed with steadfast determination, exterminating all resistance and securing decks one at a time. Aggressively yet methodically, resistance is swept aside.|In your <a href="/wh40k10ed/the-rules/boarding-action-rules/#Shooting-Phase">Shooting phase</a>, each time a <span class="tooltip00343" data-tooltip-content="#tooltip_content00343" data-tooltip-anchor="#tooltip_content00343"><span class="kwb kwbu">LEAGUES</span> <span class="kwb2 kwbu">OF</span> <span class="kwb kwbu">VOTANN</span></span> unit from your army has shot, if one or more enemy units were <span class="tooltip00260" data-tooltip-content="#tooltip_content00260"><span class="tt kwbu">destroyed</span></span> by those attacks and that <span class="kwb">LEAGUES</span> <span class="kwb2">OF</span> <span class="kwb">VOTANN</span> unit is not within <a href="/wh40k10ed/the-rules/boarding-action-rules/#Engagement-Range">Engagement Range</a> of one or more enemy units, it can make a <span class="tooltip00280" data-tooltip-content="#tooltip_content00280"><span class="tt kwbu">Normal</span> <span class="tt kwbu">move</span></span> of up to 3" and can then attempt to <a href="/wh40k10ed/the-rules/boarding-action-rules/#Open-Hatchways">operate a Hatchway</a>.|Void Salvagers|000000950|
000009536|LoV|Wrought in Wrath|The Einhyr know that they bear the weight of the ancestors’ expectations in this battle. To live up to them, they must strike with the fury of the very hearth fires of their Hold.|Add 1 to <span class="tooltip00295" data-tooltip-content="#tooltip_content00295"><span class="tt kwbu">Advance</span></span> and <span class="tooltip00080" data-tooltip-content="#tooltip_content00080"><span class="tt kwbu">Charge</span> <span class="tt kwbu">rolls</span></span> made for <span class="kwb">LEAGUES</span> <span class="kwb2">OF</span> <span class="kwb">VOTANN</span> units from your army.|Hearthfire Strike|000000951|
000009822|LoV|Methodical Annihilation|With their minds entirely focused on the singular mission with which they have been charged, the Kin work to blast a path through the enemy lines with the same tenacity as a Brôkhyr beating metal or a Cthonian miner splitting bedrock.|Each time a <span class="tooltip00343" data-tooltip-content="#tooltip_content00343" data-tooltip-anchor="#tooltip_content00343"><span class="kwb kwbu">LEAGUES</span> <span class="kwb2 kwbu">OF</span> <span class="kwb kwbu">VOTANN</span></span> model from your army makes an attack with a weapon that targets the closest eligible target or a target that is within <span class="tooltip00053" data-tooltip-content="#tooltip_content00053"><span class="tt kwbu">Engagement</span> <span class="tt kwbu">Range</span></span> of that model’s unit:<br><ul><li>Re-roll a <span class="tooltip00050" data-tooltip-content="#tooltip_content00050"><span class="tt kwbu">Wound</span> <span class="tt kwbu">roll</span></span> of 1.</li><li>If your unit is a <span class="tooltip00677" data-tooltip-content="#tooltip_content00677" data-tooltip-anchor="#tooltip_content00677"><span class="kwb kwbu">KÂHL</span></span>, <a class="kwbOne" href="/wh40k10ed/factions/leagues-of-votann/Einhyr-Hearthguard"><span class="kwb kwbo">EINHYR</span> <span class="kwb kwbo">HEARTHGUARD</span></a> or <a class="kwbOne" href="/wh40k10ed/factions/leagues-of-votann/Ûthar-the-Destined"><span class="kwb kwbo">ÛTHAR</span> <span class="kwb2 kwbo">THE</span> <span class="kwb kwbo">DESTINED</span></a> unit, improve the Armour Penetration characteristic of that attack by 1.</li></ul>|Hearthband|000001001|
000010434|LoV|Martial Leverage|The weighing of costs in Kin lives and materiel expended against prospective material benefits is an instinct amongst kinhost commanders. Those who lead needgaârd oathbands leverage the deaths of their foes into these equations at every opportunity. Crushing the enemy’s soldiery and war engines can shift the balance of martial power, enabling a canny commander to spend the advantage it provides elsewhere.|Each time an enemy unit is destroyed, you gain 1YP.|Needgaârd Oathband|000001096|
000010438|LoV|Assailed From Every Angle|The Kin of persecution prospects are skilled in escalating their attacks with unrelenting volleys of fire. They pressure the kindred’s foes repeatedly from infiltration positions, unleash enfilading fire from the flanks and surge forward to blaze away at point-blank range before manoeuvring swiftly to other attack angles. Besides the death and destruction they cause, the prospect’s forces leave foes disarrayed, with little chance to rally any ravaged survivors before other Kin capitalise on their plight.|<span class="tooltip00343" data-tooltip-content="#tooltip_content00343" data-tooltip-anchor="#tooltip_content00343"><span class="kwb kwbu">LEAGUES</span> <span class="kwb2 kwbu">OF</span> <span class="kwb kwbu">VOTANN</span></span> units from your army have the following ability:<br><br><b>Guerrilla Adepts:</b> In your <a href="/wh40k10ed/the-rules/core-rules/#SHOOTING-PHASE">Shooting phase</a>, just after this unit is selected to shoot, this unit can use this ability. If it does, select one enemy unit (excluding <span class="kwb">MONSTERS</span> and <span class="kwb">VEHICLES</span>). Until the end of the phase, attacks made by models in this unit can only target that enemy unit (and only if it is an eligible target) and, after resolving those attacks, if one or more of those attacks hit that enemy unit, until the start of your next Shooting phase, that enemy unit is assailed (this simply labels that unit for the purposes of this ability and some Enhancements and Stratagems). If that unit is already assailed, until the start of your next Shooting phase, it is also pinned. While a unit is pinned, subtract 2" from its Move characteristic and subtract 2 from <span class="tooltip00080" data-tooltip-content="#tooltip_content00080"><span class="tt kwbu">Charge</span> <span class="tt kwbu">rolls</span></span> made for it.|Persecution Prospect|000001097|
