id|faction_id|name|legend|description|detachment|detachment_id|
000009804|CD|Beguiling Aura|The daemons of the Dark Prince can bewitch the minds of their foes, appearing in one moment as their true and nightmarish selves and in the next as the object of their foes’ most forbidden desires or devoted affections. Enemies are left foundering and bewildered as the daemons weave their sinuous dances around them and trill their nerve-shredding siren songs.|<span class="tooltip00629" data-tooltip-content="#tooltip_content00629" data-tooltip-anchor="#tooltip_content00629"><span class="kwb kwbu">LEGIONES</span> <span class="kwb kwbu">DAEMONICA</span> <span class="kwb kwbu">SLAANESH</span></span> units from your army are eligible to <a href="/wh40k10ed/the-rules/core-rules/#CHARGE-PHASE">declare a charge</a> in a turn in which they <span class="tooltip00054" data-tooltip-content="#tooltip_content00054"><span class="tt kwbu">Fell</span> <span class="tt kwbu">Back</span></span>.|Legion of Excess|000000997|
000009805|CD|Seductive Gambit|Temptation is a deadly weapon in the arsenal of the daemons of Slaanesh. To tease warriors’ pride with visions of martial glory or to lure the deluded and desperate into a bladed embrace, they delight in dangling themselves like bait or feigning helpless weakness, then striking with savage release at their overextended foes. |<span class="tooltip00629" data-tooltip-content="#tooltip_content00629" data-tooltip-anchor="#tooltip_content00629"><span class="kwb kwbu">LEGIONES</span> <span class="kwb kwbu">DAEMONICA</span> <span class="kwb kwbu">SLAANESH</span></span> units from your army have the following ability:<br><br><b>Seductive Gambit:</b> Each time this unit ends a <span class="tooltip00080" data-tooltip-content="#tooltip_content00080"><span class="tt kwbu">Charge</span> <span class="tt kwbu">move</span></span>, you can declare it will perform a Seductive Gambit. If you do, until the end of the turn, this unit does not have the <span class="tooltip00591" data-tooltip-content="#tooltip_content00591"><span class="tt kwbu">Fights</span> <span class="tt kwbu">First</span></span> ability, but instead, each time a model in this unit makes an attack, you can re-roll the <span class="tooltip00003" data-tooltip-content="#tooltip_content00003"><span class="tt kwbu">Hit</span> <span class="tt kwbu">roll</span></span> and you can re-roll a <span class="tooltip00050" data-tooltip-content="#tooltip_content00050"><span class="tt kwbu">Wound</span> <span class="tt kwbu">roll</span></span> of 1.|Legion of Excess|000000997|
000009809|CD|Fates in Flux|With every chance for change seized, every new fraying of fate’s weave, the daemons and their foes alike fuel the power of Tzeentch, however inadvertently. |You start the battle with three Flux tokens (we recommend using a dice to track how many Flux tokens you have). You can spend one Flux token just after an <span class="tooltip00295" data-tooltip-content="#tooltip_content00295"><span class="tt kwbu">Advance</span> <span class="tt kwbu">roll</span></span>, <span class="tooltip00003" data-tooltip-content="#tooltip_content00003"><span class="tt kwbu">Hit</span> <span class="tt kwbu">roll</span></span>, <span class="tooltip00050" data-tooltip-content="#tooltip_content00050"><span class="tt kwbu">Wound</span> <span class="tt kwbu">roll</span></span>, Damage roll, <span class="tooltip00079" data-tooltip-content="#tooltip_content00079"><span class="tt kwbu">saving</span> <span class="tt kwbu">throw</span></span> or <span class="tooltip00024" data-tooltip-content="#tooltip_content00024"><span class="tt kwbu">Hazardous</span> <span class="tt kwbu">test</span></span> is made for a <span class="tooltip00633" data-tooltip-content="#tooltip_content00633" data-tooltip-anchor="#tooltip_content00633"><span class="kwb kwbu">LEGIONES</span> <span class="kwb kwbu">DAEMONICA</span> <span class="kwb kwbu">TZEENTCH</span></span> model or <span class="kwb">LEGIONES</span> <span class="kwb">DAEMONICA</span> <span class="kwb">TZEENTCH</span> unit from your army to re-roll the result of that roll, throw or test. Flux tokens can also be spent to enhance the effect of some Stratagems. Each time you spend a Flux token, reduce the number of Flux tokens you have by one and your opponent gains one Flux token.<br><br>Whenever your opponent has one or more Flux tokens, they can spend one Flux token after an Advance roll, Hit roll, Wound roll or saving throw is made for a model or unit from their army, to re-roll the result of that roll or throw. If they do, they reduce the number of Flux tokens they have by one and you gain one Flux token. This is ignored if your opponent has the Fates in Flux Detachment rule.<br><br>In your <a href="/wh40k10ed/the-rules/core-rules/#COMMAND-PHASE">Command phase</a>, if your opponent has one or more Flux tokens, you gain one Flux token.<br><br><b>Designer’s Note:</b> <i>When using <a href="/wh40k10ed/the-rules/core-rules/#Fast-Dice-Rolling">fast dice rolling</a>, this rule can be used to spend any number of Flux tokens (up to the amount you have), to re-roll a number of dice up to the amount spent, after rolling multiple rolls or <span class="tooltip00079" data-tooltip-content="#tooltip_content00079"><span class="tt kwbu">saving</span> <span class="tt kwbu">throws</span></span> at once.</i>|Scintillating Legion|000000998|
000009813|CD|Murdercall|The daemons of Khorne are physical manifestations of rage, hate and the desperate need to shed blood. For as long as their physical forms remain in realspace, they will never cease their murderous rampage.|Each time an enemy unit (excluding <a href="/wh40k10ed/the-rules/core-rules/#Aircraft"><span class="kwb">AIRCRAFT</span></a>) ends a <span class="tooltip00280" data-tooltip-content="#tooltip_content00280"><span class="tt kwbu">Normal</span></span> or <span class="tooltip00295" data-tooltip-content="#tooltip_content00295"><span class="tt kwbu">Advance</span> <span class="tt kwbu">move</span></span> within 6" of one or more <span class="tooltip00630" data-tooltip-content="#tooltip_content00630" data-tooltip-anchor="#tooltip_content00630"><span class="kwb kwbu">LEGIONES</span> <span class="kwb kwbu">DAEMONICA</span> <span class="kwb kwbu">KHORNE</span></span> units from your army, one of those <span class="kwb">LEGIONES</span> <span class="kwb">DAEMONICA</span> <span class="kwb">KHORNE</span> units can make a Surge move towards that enemy unit. To do so, roll one D6: models in your unit move a number of inches up to this result, but your unit must end that move as close as possible to that enemy unit. When doing so, those models can be moved within <span class="tooltip00053" data-tooltip-content="#tooltip_content00053"><span class="tt kwbu">Engagement</span> <span class="tt kwbu">Range</span></span> of that enemy unit. A unit cannot make a Surge move while it is within Engagement Range of one or more enemy units. |Blood Legion|000000999|
000009814|CD|Blood Tainted|Lifeblood spilt by the daemons of Khorne is tainted by their infernal touch, staining the ground dark with murder.|At the end of a phase in which a <span class="tooltip00630" data-tooltip-content="#tooltip_content00630" data-tooltip-anchor="#tooltip_content00630"><span class="kwb kwbu">LEGIONES</span> <span class="kwb kwbu">DAEMONICA</span> <span class="kwb kwbu">KHORNE</span></span> unit from your army destroyed an enemy unit that was within range of an <span class="tooltip00045" data-tooltip-content="#tooltip_content00045"><span class="tt kwbu">objective</span> <span class="tt kwbu">marker</span></span> at the start of the phase, if your unit has a higher Level of Control over that objective marker, that objective marker remains under your control until your opponent’s Level of Control over that objective marker is greater than yours at the end of a phase.|Blood Legion|000000999|
000009818|CD|Melancholic Miasma|To fight the daemons of Nurgle is to endure their entropic assaults upon both the physical and spiritual battlefields. The horror of inevitable decay claws at the souls of their victims even as the daemons’ splintered talons rake their flesh, heralding nightmarish putrefaction and impending doom. |While an enemy unit is within 9" of one or more <span class="tooltip00631" data-tooltip-content="#tooltip_content00631" data-tooltip-anchor="#tooltip_content00631"><span class="kwb kwbu">LEGIONES</span> <span class="kwb kwbu">DAEMONICA</span> <span class="kwb kwbu">NURGLE</span></span> units from your army, that enemy unit is within your army’s <span class="tooltip00519" data-tooltip-content="#tooltip_content00519"><span class="tt kwbu">Shadow</span> <span class="tt kwbu">of</span> <span class="tt kwbu">Chaos</span></span>. In each player’s <a href="/wh40k10ed/the-rules/core-rules/#COMMAND-PHASE">Command phase</a>, select one enemy unit within your army’s Shadow of Chaos. That unit must take a <span class="tooltip00082" data-tooltip-content="#tooltip_content00082"><span class="tt kwbu">Battle-shock</span> <span class="tt kwbu">test</span></span>.|Plague Legion|000001000|
000009976|CD|Thralls of the First Prince||<div class="Columns2"><div class="BreakInsideAvoid">When mustering your army, you cannot include any <a class="kwbOne" href="/wh40k10ed/factions/chaos-daemons/Daemon-Prince-Of-Chaos"><span class="kwb kwbo">DAEMON</span> <span class="kwb kwbo">PRINCE</span></a>, <a class="kwbOne" href="/wh40k10ed/factions/chaos-daemons/Daemon-Prince-Of-Chaos-With-Wings"><span class="kwb kwbo">DAEMON</span> <span class="kwb kwbo">PRINCE</span> <span class="kwb2 kwbo">WITH</span> <span class="kwb kwbo">WINGS</span></a> or <span class="tooltip00785" data-tooltip-content="#tooltip_content00785" data-tooltip-anchor="#tooltip_content00785"><span class="kwb kwbu">EPIC</span> <span class="kwb kwbu">HERO</span></span> units (excluding <a class="kwbOne" href="/wh40k10ed/factions/chaos-daemons/Be-lakor"><span class="kwb kwbo">BE’LAKOR</span></a>), but you can include the following <span class="kwb">HERETIC</span> <span class="kwb">ASTARTES</span> units:<br><ul><li><span class="tooltip00642" data-tooltip-content="#tooltip_content00642" data-tooltip-anchor="#tooltip_content00642"><span class="kwb kwbu">CHAOS</span> <span class="kwb kwbu">LORD</span></span></li><li><a class="kwbOne" href="/wh40k10ed/factions/chaos-space-marines/Chaos-Lord-In-Terminator-Armour"><span class="kwb kwbo">CHAOS</span> <span class="kwb kwbo">LORD</span> <span class="kwb2 kwbo">IN</span> <span class="kwb kwbo">TERMINATOR</span> <span class="kwb kwbo">ARMOUR</span></a></li><li><a class="kwbOne" href="/wh40k10ed/factions/chaos-space-marines/Chaos-Lord-with-Jump-Pack"><span class="kwb kwbo">CHAOS</span> <span class="kwb kwbo">LORD</span> <span class="kwb2 kwbo">WITH</span> <span class="kwb kwbo">JUMP</span> <span class="kwb kwbo">PACK</span></a></li><li><a class="kwbOne" href="/wh40k10ed/factions/chaos-space-marines/Chaos-Terminator-Squad"><span class="kwb kwbo">CHAOS</span> <span class="kwb kwbo">TERMINATOR</span> <span class="kwb kwbo">SQUAD</span></a></li><li><a class="kwbOne" href="/wh40k10ed/factions/chaos-space-marines/Chosen"><span class="kwb kwbo">CHOSEN</span></a></li><li><span class="tooltip00507" data-tooltip-content="#tooltip_content00507" data-tooltip-anchor="#tooltip_content00507"><span class="kwb kwbu">DAMNED</span></span> units</li><li><a class="kwbOne" href="/wh40k10ed/factions/chaos-space-marines/Dark-Apostle"><span class="kwb kwbo">DARK</span> <span class="kwb kwbo">APOSTLE</span></a></li><li><a class="kwbOne" href="/wh40k10ed/factions/chaos-space-marines/Havocs"><span class="kwb kwbo">HAVOCS</span></a></li><li><a class="kwbOne" href="/wh40k10ed/factions/chaos-space-marines/Legionaries"><span class="kwb kwbo">LEGIONARIES</span></a></li><li><a class="kwbOne" href="/wh40k10ed/factions/chaos-space-marines/Master-Of-Possession"><span class="kwb kwbo">MASTER</span> <span class="kwb2 kwbo">OF</span> <span class="kwb kwbo">POSSESSION</span></a></li><li><a class="kwbOne" href="/wh40k10ed/factions/chaos-space-marines/Possessed"><span class="kwb kwbo">POSSESSED</span></a></li><li><a class="kwbOne" href="/wh40k10ed/factions/chaos-space-marines/Raptors"><span class="kwb kwbo">RAPTORS</span></a></li><li><span class="tooltip00786" data-tooltip-content="#tooltip_content00786" data-tooltip-anchor="#tooltip_content00786"><span class="kwb kwbu">SORCERER</span></span></li><li><a class="kwbOne" href="/wh40k10ed/factions/chaos-space-marines/Sorcerer-In-Terminator-Armour"><span class="kwb kwbo">SORCERER</span> <span class="kwb2 kwbo">IN</span> <span class="kwb kwbo">TERMINATOR</span> <span class="kwb kwbo">ARMOUR</span></a></li><li><a class="kwbOne" href="/wh40k10ed/factions/chaos-space-marines/Warp-Talons"><span class="kwb kwbo">WARP</span> <span class="kwb kwbo">TALONS</span></a></li></ul><br>The combined points value of such units depends on your battle size, as shown below.<br><ul><li><b>Incursion:</b> Up to 500 pts</li><li><b>Strike Force:</b> Up to 1000 pts</li><li><b>Onslaught:</b> Up to 1500 pts</li></ul><br></div><span class="h_custom">KEYWORDS</span><br><a class="kwbOne" href="/wh40k10ed/factions/chaos-daemons/Be-lakor"><span class="kwb kwbo">BE’LAKOR</span></a> and <span class="tooltip00787" data-tooltip-content="#tooltip_content00787" data-tooltip-anchor="#tooltip_content00787"><span class="kwb kwbu">HERETIC</span> <span class="kwb kwbu">ASTARTES</span></span> units from your army gain the <span class="kwb">SHADOW</span> <span class="kwb">LEGION</span> and <span class="kwb">UNDIVIDED</span> keywords.<br><br><span class="tooltip00523" data-tooltip-content="#tooltip_content00523" data-tooltip-anchor="#tooltip_content00523"><span class="kwb kwbu">LEGIONES</span> <span class="kwb kwbu">DAEMONICA</span></span> units from your army gain the <span class="kwb">SHADOW</span> <span class="kwb">LEGION</span> keyword.</div>|Shadow Legion|000001027|
000009978|CD|First Prince of Chaos|Elevated to the status of Daemon Prince by the combined might of the four Dark Gods of Chaos, Be’lakor exudes unimaginable power.|Units from your army have the relevant abilities presented below.<br><br><div class="Columns2"><div class="BreakInsideAvoid"><table max-width="480px" border="0" cellpadding="3" style="border-width:0px"><tbody><tbody class="clFl ALAL ALKH LDLD LDDI LDSH LDLE LDSC LDBL LDPL LDDA LDIO LDRR LDDC LDPI"><tr><td class="td_w"><p style="display:block" class="impact18">MURDERER’S COWL</p><p class="ShowFluff legend2">The most murderous seek not to hide in the Dark Master’s pall. The shadows extend before them, offering a rapid route to slaughter.</p><p><span class="tooltip00788" data-tooltip-content="#tooltip_content00788" data-tooltip-anchor="#tooltip_content00788"><span class="kwb kwbu">SHADOW</span> <span class="kwb kwbu">LEGION</span> <span class="kwb kwbu">KHORNE</span></span> units only. This unit is eligible to shoot and <a href="/wh40k10ed/the-rules/core-rules/#CHARGE-PHASE">declare a charge</a> in a turn in which it <span class="tooltip00295" data-tooltip-content="#tooltip_content00295"><span class="tt kwbu">Advanced</span></span>.</p></td></tr></tbody></tbody></table></div><div class="BreakInsideAvoid"><table max-width="480px" border="0" cellpadding="3" style="border-width:0px"><tbody><tbody class="clFl ALAL ALTZ LDLD LDDI LDSH LDLE LDSC LDBL LDPL LDDA LDIO LDRR LDDC LDPI"><tr><td class="td_w"><p style="display:block" class="impact18">PENUMBRAL PUPPETRY</p><p class="ShowFluff legend2">Mutative agents of change, touched by the Dark Master’s umbral aura, summon illusory magicks to confound and confuse their desperate foes.</p><p><span class="tooltip00789" data-tooltip-content="#tooltip_content00789" data-tooltip-anchor="#tooltip_content00789"><span class="kwb kwbu">SHADOW</span> <span class="kwb kwbu">LEGION</span> <span class="kwb kwbu">TZEENTCH</span></span> units only. Each time an attack targets this unit, subtract 1 from the <span class="tooltip00003" data-tooltip-content="#tooltip_content00003"><span class="tt kwbu">Hit</span> <span class="tt kwbu">roll</span></span>.</p></td></tr></tbody></tbody></table></div><div class="BreakInsideAvoid"><table max-width="480px" border="0" cellpadding="3" style="border-width:0px"><tbody><tbody class="clFl ALAL ALNU LDLD LDDI LDSH LDLE LDSC LDBL LDPL LDDA LDIO LDRR LDDC LDPI"><tr><td class="td_w"><p style="display:block" class="impact18">GLOAM ROT</p><p class="ShowFluff legend2">Borne upon the gloaming wisp of Be’lakor’s shadow, this debilitating curse atrophies muscle and withers flesh, greatly weakening its victims.</p><p><span class="tooltip00790" data-tooltip-content="#tooltip_content00790" data-tooltip-anchor="#tooltip_content00790"><span class="kwb kwbu">SHADOW</span> <span class="kwb kwbu">LEGION</span> <span class="kwb kwbu">NURGLE</span></span> units only. Each time an attack targets this unit, if the Strength characteristic of that attack is greater than this unit’s Toughness characteristic, subtract 1 from the <span class="tooltip00050" data-tooltip-content="#tooltip_content00050"><span class="tt kwbu">Wound</span> <span class="tt kwbu">roll</span></span>.</p></td></tr></tbody></tbody></table></div><div class="BreakInsideAvoid"><table max-width="480px" border="0" cellpadding="3" style="border-width:0px"><tbody><tbody class="clFl ALAL ALSL LDLD LDDI LDSH LDLE LDSC LDBL LDPL LDDA LDIO LDRR LDDC LDPI"><tr><td class="td_w"><p style="display:block" class="impact18">SHADOW’S CARESS</p><p class="ShowFluff legend2">The Dark Master’s shadow falls across his thralls, masking their approach.</p><p><span class="tooltip00791" data-tooltip-content="#tooltip_content00791" data-tooltip-anchor="#tooltip_content00791"><span class="kwb kwbu">SHADOW</span> <span class="kwb kwbu">LEGION</span> <span class="kwb kwbu">SLAANESH</span></span> units only. Enemy units cannot use the <span class="tooltip00324" data-tooltip-content="#tooltip_content00324"><span class="tt kwbu">Fire</span> <span class="tt kwbu">Overwatch</span></span> Stratagem to shoot at this unit.</p></td></tr></tbody></tbody></table></div><div class="BreakInsideAvoid"><table max-width="480px" border="0" cellpadding="3" style="border-width:0px"><tbody><tbody><tr><td class="td_w"><p style="display:block" class="impact18">DISCIPLES OF BE’LAKOR</p><p class="ShowFluff legend2">Be’lakor’s immortal ego draws into his orbit those as yet unclaimed by any one Chaos God. Their hate-filled pacts are made to the entire fell pantheon, and the dangerous boons they receive see them plunged along paths of perpetual night straight into the enemy’s midst.</p><p><span class="tooltip00792" data-tooltip-content="#tooltip_content00792" data-tooltip-anchor="#tooltip_content00792"><span class="kwb kwbu">SHADOW</span> <span class="kwb kwbu">LEGION</span> <span class="kwb kwbu">UNDIVIDED</span></span> units only.<br><ul><li>This unit has the <span class="tooltip00506" data-tooltip-content="#tooltip_content00506"><span class="tt kwbu">Dark</span> <span class="tt kwbu">Pacts</span></span> army rule, and can use it as described in <i>Codex: Chaos Space Marines</i>, even though your Army Faction is not <span class="kwb">HERETIC</span> <span class="kwb">ASTARTES</span>. If this unit is <a class="kwbOne" href="/wh40k10ed/factions/chaos-daemons/Be-lakor"><span class="kwb kwbo">BE’LAKOR</span></a>, it automatically passes the <span class="tooltip00587" data-tooltip-content="#tooltip_content00587"><span class="tt kwbu">Leadership</span> <span class="tt kwbu">test</span></span> required for Dark Pacts.</li><li><span class="tooltip00793" data-tooltip-content="#tooltip_content00793" data-tooltip-anchor="#tooltip_content00793"><span class="kwb kwbu">SHADOW</span> <span class="kwb kwbu">LEGION</span> <span class="kwb kwbu">HERETIC</span> <span class="kwb kwbu">ASTARTES</span></span> models in this unit have the <span class="tooltip00065" data-tooltip-content="#tooltip_content00065"><span class="tt kwbu">Deep</span> <span class="tt kwbu">Strike</span></span> ability.</li></ul></p></td></tr></tbody></tbody></table></div></div>|Shadow Legion|000001027|
000008362|CSM|Marks of Chaos||When mustering your army, when you select a <span class="kwb">HERETIC</span> <span class="kwb">ASTARTES</span> unit to include in your army, if that unit is not an <span class="tooltip00559" data-tooltip-content="#tooltip_content00559" data-tooltip-anchor="#tooltip_content00559"><span class="kwb kwbu">EPIC</span> <span class="kwb kwbu">HERO</span></span> and does not already have one of the following keywords, you must select one for that unit and note it on your Army Roster: <span class="tooltip00643" data-tooltip-content="#tooltip_content00643" data-tooltip-anchor="#tooltip_content00643"><span class="kwb kwbu">KHORNE</span></span>. <span class="tooltip00794" data-tooltip-content="#tooltip_content00794" data-tooltip-anchor="#tooltip_content00794"><span class="kwb kwbu">TZEENTCH</span></span>, <span class="tooltip00795" data-tooltip-content="#tooltip_content00795" data-tooltip-anchor="#tooltip_content00795"><span class="kwb kwbu">NURGLE</span></span>, <span class="tooltip00796" data-tooltip-content="#tooltip_content00796" data-tooltip-anchor="#tooltip_content00796"><span class="kwb kwbu">SLAANESH</span></span>, <span class="tooltip00797" data-tooltip-content="#tooltip_content00797" data-tooltip-anchor="#tooltip_content00797"><span class="kwb kwbu">CHAOS</span> <span class="kwb kwbu">UNDIVIDED</span></span>. Each time a unit with one of these keywords gains a weapon ability as the result of a <span class="tooltip00506" data-tooltip-content="#tooltip_content00506"><span class="tt kwbu">Dark</span> <span class="tt kwbu">Pact</span></span> and does not fail the resulting <span class="tooltip00587" data-tooltip-content="#tooltip_content00587"><span class="tt kwbu">Leadership</span> <span class="tt kwbu">test</span></span>, until the end of the phase, that unit gains the associated ability below.<br><br><span class="hi_custom">UNITS THAT GAINED <span class="kwb2 bluefont"><span class="tooltip00277" data-tooltip-content="#tooltip_content00277"><span class="tt kwbu">[LETHAL</span> <span class="tt kwbu">HITS]</span></span></span></span><br><ul><li><span class="kwb">KHORNE:</span> Each time a model in this unit makes a melee attack, an unmodified <span class="tooltip00003" data-tooltip-content="#tooltip_content00003"><span class="tt kwbu">Hit</span> <span class="tt kwbu">roll</span></span> of 5+ scores a <span class="tooltip00003" data-tooltip-content="#tooltip_content00003"><span class="tt kwbu">Critical</span> <span class="tt kwbu">Hit</span></span>.</li><li><span class="kwb">TZEENTCH:</span> Each time a model in this unit makes a ranged attack, an unmodified Hit roll of 5+ scores a Critical Hit.</li><li><span class="kwb">CHAOS</span> <span class="kwb">UNDIVIDED:</span> Each time a model in this unit makes an attack, re-roll a Hit  roll of 1.</li></ul><br><span class="hi_custom">UNITS THAT GAINED <span class="kwb2 bluefont"><span class="tooltip00001" data-tooltip-content="#tooltip_content00001"><span class="tt kwbu">[SUSTAINED</span> <span class="tt kwbu">HITS</span> <span class="tt kwbu">1]</span></span></span></span><br><ul><li><span class="kwb">NURGLE:</span> Each time a model in this unit makes a ranged attack, an unmodified Hit roll of 5+ scores a Critical Hit.</li><li><span class="kwb">SLAANESH:</span> Each time a model in this unit makes a melee attack, an unmodified Hit roll of 5+ scores a Critical Hit.</li><li><span class="kwb">CHAOS</span> <span class="kwb">UNDIVIDED:</span> Each time a model in this unit makes an attack, re-roll a Hit roll of 1.</li></ul><br><span class="hi_custom">RESTRICTIONS</span><br><ul><li>You cannot select the <span class="kwb">KHORNE</span> keyword for a <span class="tooltip00508" data-tooltip-content="#tooltip_content00508" data-tooltip-anchor="#tooltip_content00508"><span class="kwb kwbu">PSYKER</span></span> unit.</li><li>A <span class="tooltip00383" data-tooltip-content="#tooltip_content00383" data-tooltip-anchor="#tooltip_content00383"><span class="kwb kwbu">CHARACTER</span></span> unit can only be attached to a unit if both units share the same keyword from the list above.</li><li>A unit can only embark within (or start the battle embarked within) a <span class="kwb">TRANSPORT</span> if both of those units share the same keyword from the list above.</li></ul>|Pactbound Zealots|000000751|
000008959|CSM|Focus of Hatred|The eldest of the Chaos Space Marines harbour within their corrupted souls a burning desire for vengeance upon the Imperium and the galaxy as a whole.  They channel this ire against their chosen targets, relentlessly pursuing their victims until every last foe lies dead upon the battlefield. |At the start of your <a href="/wh40k10ed/the-rules/core-rules/#COMMAND-PHASE">Command phase</a>, select one unit from your opponents army to be your focus of hatred. Until the start of your next Command phase,  each time a <span class="kwb">HERETIC</span> <span class="kwb">ASTARTES</span> model from  your army (excluding <span class="tooltip00507" data-tooltip-content="#tooltip_content00507" data-tooltip-anchor="#tooltip_content00507"><span class="kwb kwbu">DAMNED</span></span> models) makes an attack that targets your focus of hatred, you can re-roll the <span class="tooltip00003" data-tooltip-content="#tooltip_content00003"><span class="tt kwbu">Hit</span> <span class="tt kwbu">roll</span></span>.|Veterans of the Long War|000000867|
